[
  {
    "is_synthetic": true,
    "id": "SITE-001",
    "customer_id": "CUS-001",
    "country_code": "DE",
    "name": "演示柏林站点-001",
    "timezone": "Europe/Berlin",
    "address_label": "柏林·虚构站点001（无真实街道地址）",
    "segment": "residential",
    "installer_customer_id": "CUS-002",
    "tenant_id": "TENANT-001"
  },
  {
    "is_synthetic": true,
    "id": "SITE-002",
    "customer_id": "CUS-002",
    "country_code": "DE",
    "name": "演示柏林站点-002",
    "timezone": "Europe/Berlin",
    "address_label": "柏林·虚构站点002（无真实街道地址）",
    "segment": "residential",
    "installer_customer_id": "CUS-002",
    "tenant_id": "TENANT-002"
  },
  {
    "is_synthetic": true,
    "id": "SITE-003",
    "customer_id": "CUS-003",
    "country_code": "DE",
    "name": "演示柏林站点-003",
    "timezone": "Europe/Berlin",
    "address_label": "柏林·虚构站点003（无真实街道地址）",
    "segment": "residential",
    "installer_customer_id": "CUS-002",
    "tenant_id": "TENANT-003"
  },
  {
    "is_synthetic": true,
    "id": "SITE-004",
    "customer_id": "CUS-004",
    "country_code": "DE",
    "name": "演示柏林站点-004",
    "timezone": "Europe/Berlin",
    "address_label": "柏林·虚构站点004（无真实街道地址）",
    "segment": "residential",
    "installer_customer_id": "CUS-002",
    "tenant_id": "TENANT-004"
  },
  {
    "is_synthetic": true,
    "id": "SITE-005",
    "customer_id": "CUS-005",
    "country_code": "DE",
    "name": "演示柏林站点-005",
    "timezone": "Europe/Berlin",
    "address_label": "柏林·虚构站点005（无真实街道地址）",
    "segment": "residential",
    "installer_customer_id": "CUS-002",
    "tenant_id": "TENANT-005"
  },
  {
    "is_synthetic": true,
    "id": "SITE-006",
    "customer_id": "CUS-006",
    "country_code": "DE",
    "name": "演示柏林站点-006",
    "timezone": "Europe/Berlin",
    "address_label": "柏林·虚构站点006（无真实街道地址）",
    "segment": "residential",
    "installer_customer_id": "CUS-002",
    "tenant_id": "TENANT-006"
  },
  {
    "is_synthetic": true,
    "id": "SITE-007",
    "customer_id": "CUS-007",
    "country_code": "DE",
    "name": "演示柏林站点-007",
    "timezone": "Europe/Berlin",
    "address_label": "柏林·虚构站点007（无真实街道地址）",
    "segment": "residential",
    "installer_customer_id": "CUS-002",
    "tenant_id": "TENANT-007"
  },
  {
    "is_synthetic": true,
    "id": "SITE-008",
    "customer_id": "CUS-008",
    "country_code": "DE",
    "name": "演示柏林站点-008",
    "timezone": "Europe/Berlin",
    "address_label": "柏林·虚构站点008（无真实街道地址）",
    "segment": "residential",
    "installer_customer_id": "CUS-002",
    "tenant_id": "TENANT-008"
  },
  {
    "is_synthetic": true,
    "id": "SITE-009",
    "customer_id": "CUS-009",
    "country_code": "DE",
    "name": "演示柏林站点-009",
    "timezone": "Europe/Berlin",
    "address_label": "柏林·虚构站点009（无真实街道地址）",
    "segment": "residential",
    "installer_customer_id": "CUS-002",
    "tenant_id": "TENANT-009"
  },
  {
    "is_synthetic": true,
    "id": "SITE-010",
    "customer_id": "CUS-010",
    "country_code": "DE",
    "name": "演示柏林站点-010",
    "timezone": "Europe/Berlin",
    "address_label": "柏林·虚构站点010（无真实街道地址）",
    "segment": "residential",
    "installer_customer_id": "CUS-002",
    "tenant_id": "TENANT-010"
  },
  {
    "is_synthetic": true,
    "id": "SITE-011",
    "customer_id": "CUS-011",
    "country_code": "DE",
    "name": "演示柏林站点-011",
    "timezone": "Europe/Berlin",
    "address_label": "柏林·虚构站点011（无真实街道地址）",
    "segment": "commercial",
    "installer_customer_id": "CUS-002",
    "tenant_id": "TENANT-011"
  },
  {
    "is_synthetic": true,
    "id": "SITE-012",
    "customer_id": "CUS-012",
    "country_code": "DE",
    "name": "演示柏林站点-012",
    "timezone": "Europe/Berlin",
    "address_label": "柏林·虚构站点012（无真实街道地址）",
    "segment": "commercial",
    "installer_customer_id": "CUS-002",
    "tenant_id": "TENANT-012"
  },
  {
    "is_synthetic": true,
    "id": "SITE-013",
    "customer_id": "CUS-001",
    "country_code": "DE",
    "name": "演示柏林站点-013",
    "timezone": "Europe/Berlin",
    "address_label": "柏林·虚构站点013（无真实街道地址）",
    "segment": "commercial",
    "installer_customer_id": "CUS-002",
    "tenant_id": "TENANT-001"
  },
  {
    "is_synthetic": true,
    "id": "SITE-014",
    "customer_id": "CUS-002",
    "country_code": "DE",
    "name": "演示柏林站点-014",
    "timezone": "Europe/Berlin",
    "address_label": "柏林·虚构站点014（无真实街道地址）",
    "segment": "commercial",
    "installer_customer_id": "CUS-002",
    "tenant_id": "TENANT-002"
  },
  {
    "is_synthetic": true,
    "id": "SITE-015",
    "customer_id": "CUS-003",
    "country_code": "DE",
    "name": "演示柏林站点-015",
    "timezone": "Europe/Berlin",
    "address_label": "柏林·虚构站点015（无真实街道地址）",
    "segment": "commercial",
    "installer_customer_id": "CUS-002",
    "tenant_id": "TENANT-003"
  },
  {
    "is_synthetic": true,
    "id": "SITE-016",
    "customer_id": "CUS-004",
    "country_code": "DE",
    "name": "演示柏林站点-016",
    "timezone": "Europe/Berlin",
    "address_label": "柏林·虚构站点016（无真实街道地址）",
    "segment": "commercial",
    "installer_customer_id": "CUS-002",
    "tenant_id": "TENANT-004"
  },
  {
    "is_synthetic": true,
    "id": "SITE-017",
    "customer_id": "CUS-005",
    "country_code": "DE",
    "name": "演示柏林站点-017",
    "timezone": "Europe/Berlin",
    "address_label": "柏林·虚构站点017（无真实街道地址）",
    "segment": "commercial",
    "installer_customer_id": "CUS-002",
    "tenant_id": "TENANT-005"
  },
  {
    "is_synthetic": true,
    "id": "SITE-018",
    "customer_id": "CUS-006",
    "country_code": "DE",
    "name": "演示柏林站点-018",
    "timezone": "Europe/Berlin",
    "address_label": "柏林·虚构站点018（无真实街道地址）",
    "segment": "commercial",
    "installer_customer_id": "CUS-002",
    "tenant_id": "TENANT-006"
  },
  {
    "is_synthetic": true,
    "id": "SITE-019",
    "customer_id": "CUS-007",
    "country_code": "DE",
    "name": "演示柏林站点-019",
    "timezone": "Europe/Berlin",
    "address_label": "柏林·虚构站点019（无真实街道地址）",
    "segment": "utility",
    "installer_customer_id": "CUS-002",
    "tenant_id": "TENANT-007"
  },
  {
    "is_synthetic": true,
    "id": "SITE-020",
    "customer_id": "CUS-008",
    "country_code": "DE",
    "name": "演示柏林站点-020",
    "timezone": "Europe/Berlin",
    "address_label": "柏林·虚构站点020（无真实街道地址）",
    "segment": "utility",
    "installer_customer_id": "CUS-002",
    "tenant_id": "TENANT-008"
  },
  {
    "is_synthetic": true,
    "id": "SITE-021",
    "customer_id": "CUS-009",
    "country_code": "DE",
    "name": "演示柏林站点-021",
    "timezone": "Europe/Berlin",
    "address_label": "柏林·虚构站点021（无真实街道地址）",
    "segment": "ev_charger",
    "installer_customer_id": "CUS-002",
    "tenant_id": "TENANT-009"
  },
  {
    "is_synthetic": true,
    "id": "SITE-022",
    "customer_id": "CUS-010",
    "country_code": "DE",
    "name": "演示柏林站点-022",
    "timezone": "Europe/Berlin",
    "address_label": "柏林·虚构站点022（无真实街道地址）",
    "segment": "ev_charger",
    "installer_customer_id": "CUS-002",
    "tenant_id": "TENANT-010"
  },
  {
    "is_synthetic": true,
    "id": "SITE-023",
    "customer_id": "CUS-011",
    "country_code": "DE",
    "name": "演示柏林站点-023",
    "timezone": "Europe/Berlin",
    "address_label": "柏林·虚构站点023（无真实街道地址）",
    "segment": "balcony",
    "installer_customer_id": "CUS-002",
    "tenant_id": "TENANT-011"
  },
  {
    "is_synthetic": true,
    "id": "SITE-024",
    "customer_id": "CUS-012",
    "country_code": "DE",
    "name": "演示柏林站点-024",
    "timezone": "Europe/Berlin",
    "address_label": "柏林·虚构站点024（无真实街道地址）",
    "segment": "balcony",
    "installer_customer_id": "CUS-002",
    "tenant_id": "TENANT-012"
  },
  {
    "is_synthetic": true,
    "id": "SITE-025",
    "customer_id": "CUS-013",
    "country_code": "NL",
    "name": "演示乌得勒支站点-025",
    "timezone": "Europe/Amsterdam",
    "address_label": "乌得勒支·虚构站点025（无真实街道地址）",
    "segment": "residential",
    "installer_customer_id": "CUS-014",
    "tenant_id": "TENANT-013"
  },
  {
    "is_synthetic": true,
    "id": "SITE-026",
    "customer_id": "CUS-014",
    "country_code": "NL",
    "name": "演示乌得勒支站点-026",
    "timezone": "Europe/Amsterdam",
    "address_label": "乌得勒支·虚构站点026（无真实街道地址）",
    "segment": "residential",
    "installer_customer_id": "CUS-014",
    "tenant_id": "TENANT-014"
  },
  {
    "is_synthetic": true,
    "id": "SITE-027",
    "customer_id": "CUS-015",
    "country_code": "NL",
    "name": "演示乌得勒支站点-027",
    "timezone": "Europe/Amsterdam",
    "address_label": "乌得勒支·虚构站点027（无真实街道地址）",
    "segment": "residential",
    "installer_customer_id": "CUS-014",
    "tenant_id": "TENANT-015"
  },
  {
    "is_synthetic": true,
    "id": "SITE-028",
    "customer_id": "CUS-016",
    "country_code": "NL",
    "name": "演示乌得勒支站点-028",
    "timezone": "Europe/Amsterdam",
    "address_label": "乌得勒支·虚构站点028（无真实街道地址）",
    "segment": "residential",
    "installer_customer_id": "CUS-014",
    "tenant_id": "TENANT-016"
  },
  {
    "is_synthetic": true,
    "id": "SITE-029",
    "customer_id": "CUS-017",
    "country_code": "NL",
    "name": "演示乌得勒支站点-029",
    "timezone": "Europe/Amsterdam",
    "address_label": "乌得勒支·虚构站点029（无真实街道地址）",
    "segment": "residential",
    "installer_customer_id": "CUS-014",
    "tenant_id": "TENANT-017"
  },
  {
    "is_synthetic": true,
    "id": "SITE-030",
    "customer_id": "CUS-018",
    "country_code": "NL",
    "name": "演示乌得勒支站点-030",
    "timezone": "Europe/Amsterdam",
    "address_label": "乌得勒支·虚构站点030（无真实街道地址）",
    "segment": "residential",
    "installer_customer_id": "CUS-014",
    "tenant_id": "TENANT-018"
  },
  {
    "is_synthetic": true,
    "id": "SITE-031",
    "customer_id": "CUS-019",
    "country_code": "NL",
    "name": "演示乌得勒支站点-031",
    "timezone": "Europe/Amsterdam",
    "address_label": "乌得勒支·虚构站点031（无真实街道地址）",
    "segment": "residential",
    "installer_customer_id": "CUS-014",
    "tenant_id": "TENANT-019"
  },
  {
    "is_synthetic": true,
    "id": "SITE-032",
    "customer_id": "CUS-020",
    "country_code": "NL",
    "name": "演示乌得勒支站点-032",
    "timezone": "Europe/Amsterdam",